date,text,url,form,accepted_time
2020-08-21," 8-k 1 tm2029024-1_8k.htm form 8-k united states securities and exchange commission washington, dc 20549 form 8-k current report pursuant to section 13 or 15(d) of the securities exchange act of 1934 date of report (date of earliest event reported): august 21, 2020 (august 21, 2020) capstar special purpose acquisition corp. (exact name of registrant as specified in charter) delaware 001-39362 84-4730610 (state or other jurisdiction of incorporation) (commission file number) (irs employer identification no.) 405 west 14th street, austin, tx 78701 (address of principal executive offices) (zip code) (512) 340-7800 (registrant’s telephone number, including area code) not applicable (former name or former address, if changed since last report) securities registered or to be registered pursuant to section 12(b) of the act: title of each class trading symbol(s) name of each exchange on which registered units, each consisting of one share of class a common stock and one-half of one warrant cpsr.u the new york stock exchange class a common stock, par value $0.0001 per share cpsr the new york stock exchange warrants, each whole warrant exercisable for one share of class a common stock at an exercise price of $11.50 cpsr ws the new york stock exchange check the appropriate box below if the form 8-k filing is intended to simultaneously satisfy the filing obligation of the registrant under any of the following provisions: ¨ written communications pursuant to rule 425 under the securities act (17 cfr 230.425) ¨ soliciting material pursuant to rule 14a-12 under the exchange act (17 cfr 240.14a-12) ¨ pre-commencement communications pursuant to rule 14d-2(b) under the exchange act (17 cfr 240.14d-2(b)) ¨ pre-commencement communications pursuant to rule 13e-4(c) under the exchange act (17 cfr 240.13e-4(c)) indicate by check mark whether the registrant is an emerging growth company as defined in rule 405 of the securities act of 1933 (§230.405 of this chapter) or rule 12b-2 of the securities exchange act of 1934 (§240.12b-2 of this chapter). emerging growth company x if an emerging growth company, indicate by check mark if the registrant has elected not to use the extended transition period for complying with any new or revised financial accounting standards provided pursuant to section 13(a) of the exchange act. ¨ item 8.01. other events. on august 21, 2020, capstar special purpose acquisition corp. (the “company”) announced that, commencing on august 24, 2020, the holders of the company’s units issued in the company’s initial public offering (the “units”) may elect to separately trade the securities included in the units. each unit consists of one share of class a common stock, par value $0.0001 per share (“class a common stock”) and one-half of one redeemable warrant (“warrant”), each whole warrant entitling the holder thereof to purchase one share of class a common stock. no fractional warrants will be issued upon separation of the units and only whole warrants will trade. the units not separated will continue to trade on the new york stock exchange (the “nyse”) under the symbol “cpsr.u”. the class a common stock and the warrants are expected to trade on the nyse under the symbols “cpsr” and “cpsr ws”, respectively. holders of units will need to have their brokers contact continental stock transfer & trust company, the company’s transfer agent, in order to separate the units into class a common stock and warrants. a copy of the press release issued by the company announcing the separate trading of the securities underlying the units is included as exhibit 99.1 to this current report on form 8-k. item 9.01. financial statements and exhibits. (d) exhibits. exhibit no. description 99.1 press release dated august 21, 2020 signatures pursuant to the requirements of the securities exchange act of 1934, the registrant has duly caused this report to be signed on its behalf by the undersigned hereunto duly authorized. capstar special purpose acquisition corp. date: august 21, 2020 /s/ r. steven hicks name: r. steven hicks title: chairman, chief executive officer and chief financial officer ",https://www.sec.gov/Archives/edgar/data/1805087/000110465920097575/0001104659-20-097575-index.htm,8-K,2020-08-21 16:05:37
2020-07-13," 8-k 1 tm2024638d1_8k.htm form 8-k united states securities and exchange commission washington, d.c. 20549 form 8-k current report pursuant to section 13 or 15(d) of the securities exchange act of 1934 date of report (date of earliest event reported): july 7, 2020 capstar special purpose acquisition corp. (exact name of registrant as specified in its charter) delaware (state or other jurisdiction of incorporation) 001-39362 (commission file number) 84-4730610 (i.r.s. employer identification no.) 405 west 14th street austin, tx (address of principal executive offices) 78701 (zip code) 512-340-7800 (registrant’s telephone number, including area code) not applicable (former name or former address, if changed since last report) check the appropriate box below if the form 8-k is intended to simultaneously satisfy the filing obligation of the registrant under any of the following provisions: ¨written communications pursuant to rule 425 under the securities act (17 cfr 230.425) ¨soliciting material pursuant to rule 14a-12 under the exchange act (17 cfr 240.14a-12) ¨pre-commencement communications pursuant to rule 14d-2(b) under the exchange act (17 cfr 240.14d-2(b)) ¨pre-commencement communications pursuant to rule 13e-4(c) under the exchange act (17 cfr 240.13e-4(c)) securities registered pursuant to section 12(b) of the act: title of each class trading symbol(s) name of each exchange on which registered units, each consisting of one share of class a common stock and one-half of one warrant cpsr.u the new york stock exchange class a common stock, par value $0.0001 per share cpsr the new york stock exchange warrants, each whole warrant exercisable for one share of class a common stock at an exercise price of $11.50 cpsr ws the new york stock exchange indicate by check mark whether the registrant is an emerging growth company as defined in rule 405 of the securities act of 1933 (§230.405 of this chapter) or rule 12b-2 of the securities exchange act of 1934 (§240.12b-2 of this chapter). emerging growth company x if an emerging growth company, indicate by check mark if the registrant has elected not to use the extended transition period for complying with any new or revised financial accounting standards provided pursuant to section 13(a) of the exchange act. ¨ item 8.01. other events. on july 7, 2020, capstar special purpose acquisition corp. (the “company”) completed its initial public offering (“ipo”) of 27,600,000 units (“units”), including the issuance of 3,600,000 units as a result of the underwriters’ full exercise of their over-allotment option. each unit consists of one share of class a common stock, par value $0.0001 per share (“class a common stock”) and one-half of one redeemable warrant (“warrant”), each whole warrant entitling the holder thereof to purchase one share of class a common stock at an exercise price of $11.50 per share, subject to adjustment, pursuant to the company’s registration statements on form s-1 (file nos. 333-239094 and 333-239630​). the units were sold at an offering price of $10.00 per unit, generating gross proceeds of $276,000,000. as previously reported on a current report on form 8-k of the company, on july 7, 2020, simultaneously with the consummation of the ipo, the company completed a private placement of an aggregate of 7,520,000 warrants (the “private placement warrants”) at a price of $1.00 per private placement warrant, generating total gross proceeds of $7,520,000 (the “private placement”). a total of $276,000,000 of the net proceeds from the ipo and the private placement was deposited in a trust account established for the benefit of the company’s public stockholders. an audited balance sheet as of july 7, 2020 reflecting receipt of the proceeds upon consummation of the ipo and the private placement has been issued by the company and is attached hereto as exhibit 99.1. item 9.01. financial statements and exhibits. (d) exhibits. exhibit no. description 99.1 audited balance sheet 2 signature pursuant to the requirements of the securities exchange act of 1934, the registrant has duly caused this report to be signed on its behalf by the undersigned hereunto duly authorized. capstar special purpose acquisition corp. by: /s/ r. steven hicks name: r. steven hicks title: chairman, chief executive officer and chief financial officer date: july 13, 2020 ",https://www.sec.gov/Archives/edgar/data/1805087/000110465920083113/0001104659-20-083113-index.htm,8-K,2020-07-13 16:33:48
2020-07-08," 8-k 1 tm2011667d11_8k.htm form 8-k united states securities and exchange commission washington, d.c. 20549 form 8-k current report pursuant to section 13 or 15(d) of the securities exchange act of 1934 date of report (date of earliest event reported): july 1, 2020 capstar special purpose acquisition corp. (exact name of registrant as specified in its charter) delaware (state or other jurisdiction of incorporation) 001-39362 (commission file number) 84-4730610 (i.r.s. employer identification no.) 405 west 14th street austin, tx (address of principal executive offices) 78701 (zip code) 512-340-7800 (registrant’s telephone number, including area code) not applicable (former name or former address, if changed since last report) check the appropriate box below if the form 8-k is intended to simultaneously satisfy the filing obligation of the registrant under any of the following provisions: ¨	 written communications pursuant to rule 425 under the securities act (17 cfr 230.425) ¨	 soliciting material pursuant to rule 14a-12 under the exchange act (17 cfr 240.14a-12) ¨	 pre-commencement communications pursuant to rule 14d-2(b) under the exchange act (17 cfr 240.14d-2(b)) ¨	 pre-commencement communications pursuant to rule 13e-4(c) under the exchange act (17 cfr 240.13e-4(c)) securities registered pursuant to section 12(b) of the act: title of each class trading symbol(s) name of each exchange on which registered units, each consisting of one share of class a common stock and one-half of one warrant cpsr.u the new york stock exchange class a common stock, par value $0.0001 per share cpsr the new york stock exchange warrants, each whole warrant exercisable for one share of class a common stock at an exercise price of $11.50 cpsr ws the new york stock exchange indicate by check mark whether the registrant is an emerging growth company as defined in rule 405 of the securities act of 1933 (§230.405 of this chapter) or rule 12b-2 of the securities exchange act of 1934 (§240.12b-2 of this chapter). emerging growth company x if an emerging growth company, indicate by check mark if the registrant has elected not to use the extended transition period for complying with any new or revised financial accounting standards provided pursuant to section 13(a) of the exchange act. ¨ item 1.01. entry into a material definitive agreement. on july 1, 2020, the registration statement on form s-1 (file no. 333-239094) relating to the initial public offering (the “ipo”) of capstar special purpose acquisition corp. (the “company”) was declared effective by the u.s. securities and exchange commission, and the company subsequently filed, on july 1, 2020, a registration statement on form s-1 (file no. 333-239630) pursuant to rule 462(b) under the securities act of 1933, as amended (the “securities act”), which was effective immediately upon filing (collectively, the “registration statement”). on july 7, 2020, the company consummated the ipo of 27,600,000 units (“units”), including the issuance of 3,600,000 units as a result of the underwriters’ full exercise of their over-allotment option. each unit consists of one share of class a common stock, par value $0.0001 per share (“class a common stock”) and one-half of one redeemable warrant (“warrant”), each whole warrant entitling the holder thereof to purchase one share of class a common stock at an exercise price of $11.50 per share, subject to adjustment. the units were sold at an offering price of $10.00 per unit, generating gross proceeds to the company of $276,000,000. in connection with the ipo, the company entered into the following agreements, forms of which were previously filed as exhibits to the registration statement: ·an underwriting agreement, dated july 1, 2020, among the company and citigroup global markets inc., ubs securities llc and btig, llc, as representatives of the several underwriters named therein, a copy of which is attached as exhibit 1.1 hereto and incorporated herein by reference; ·a warrant agreement, dated july 1, 2020, between the company and continental stock transfer & trust company (“continental”), as warrant agent, a copy of which is attached as exhibit 4.1 hereto and incorporated herein by reference; ·a letter agreement, dated july 1, 2020, among the company, capstar sponsor group, llc (the “sponsor”), gccu vi llc, tocu xxix llc and each of the executive officers and directors of the company, a copy of which is attached as exhibit 10.1 hereto and incorporated herein by reference; ·an investment management trust agreement, dated july 1, 2020, between the company and continental, as trustee, a copy of which is attached as exhibit 10.2 hereto and incorporated herein by reference; ·a warrant purchase agreement, dated july 1, 2020, between the company and the sponsor, a copy of which is attached as exhibit 10.3 hereto and incorporated herein by reference; ·a registration and stockholder rights agreement, dated july 1, 2020, among the company and certain securityholders, a copy of which is attached as exhibit 10.4 hereto and incorporated herein by reference; and ·an administrative services agreement, dated july 1, 2020, between the company and capstar partners, llc, a copy of which is attached as exhibit 10.5 hereto and incorporated herein by reference. item 3.02. unregistered sales of equity securities. on july 7, 2020, simultaneously with the consummation of the ipo, the company consummated the private placement of an aggregate of 7,520,000 warrants (the “private placement warrants”) to the sponsor at a price of $1.00 per private placement warrant, generating total gross proceeds of $7,520,000 (the “private placement”). no underwriting discounts or commissions were paid with respect to the private placement. the private placement was conducted as a non-public transaction and, as a transaction by an issuer not involving a public offering, is exempt from registration under the securities act in reliance upon section 4(a)(2) of the securities act. the private placement warrants are identical to the warrants underlying the units, except that if held by the sponsor or its permitted transferees, they (i) may be exercised on a cashless basis and (ii) are not subject to redemption. if the private placement warrants are held by holders other than the sponsor or its permitted transferees, then the private placement warrants will be redeemable by the company and exercisable by the holders on the same basis as the warrants included in the units sold in the ipo. in addition, the private placement warrants (and the shares of class a common stock issuable upon exercise of such private placement warrants) will, subject to certain limited exceptions, be subject to transfer restrictions until 30 days after the completion of the company’s initial business combination. 2 item 5.02. departure of directors or certain officers; election of directors; appointment of certain officers; compensatory arrangements of certain officers. effective as of july 1, 2020, the following individuals were appointed to the board of directors of the company: rodrigo de la torre, jamie weinstein, kathryn cavanaugh, john ghiselli and james whittenburg. additional information regarding, among other things, each individual’s background, board committee membership and compensatory arrangements is contained in the registration statement and is incorporated herein by reference. item 5.03. amendments to certificate of incorporation or bylaws; change in fiscal year. on july 1, 2020, the company filed its amended and restated certificate of incorporation (the “certificate of incorporation”) with the secretary of state of the state of delaware, which was effective the same day. among other things, the certificate of incorporation authorizes the issuance of (a) up to 110,000,000 shares of common stock, including (i) 100,000,000 shares of class a common stock and (ii) 10,000,000 shares of class b common stock, par value $0.0001 per share, and (b) up to 1,000,000 shares of preferred stock, par value $0.0001 per share. the terms of the certificate of incorporation are set forth in the registration statement and are incorporated herein by reference. the foregoing description of the certificate of incorporation is qualified in its entirety by reference to the full text of the certificate of incorporation, which is attached as exhibit 3.1 hereto and is incorporated herein by reference. item 8.01. other events. a total of $276,000,000 of the net proceeds from the ipo and the private placement was placed in a trust account established for the benefit of the company’s public stockholders (the “trust account”), with continental acting as trustee. except with respect to interest earned on the funds held in the trust account that may be released to the company to pay its franchise and income tax obligations (less up to $100,000 interest to pay dissolution expenses), none of the funds held in the trust account will be released from the trust account until the earliest of (i) the completion of the company’s initial business combination, (ii) the redemption of any shares of class a common stock included in the units sold in the ipo (“public shares”) properly submitted in connection with a stockholder vote to amend the certificate of incorporation (a) to modify the substance or timing of the company’s obligation to redeem 100% of the public shares if the company does not complete its initial business combination within 24 months from the closing of the ipo or (b) with respect to any other provision relating to stockholders’ rights or pre-initial business combination activity and (iii) the redemption of the public shares if the company does not complete an initial business combination within 24 months from the closing of the ipo, subject to applicable law. on july 1, 2020, the company issued a press release announcing the pricing of the ipo, a copy of which is attached as exhibit 99.1 hereto and incorporated herein by reference. 3 item 9.01. financial statements and exhibits. (d) exhibits. exhibit no. description 1.1 underwriting agreement, dated july 1, 2020, among the company and citigroup global markets inc., ubs securities llc and btig, llc 3.1 amended and restated certificate of incorporation of the company 4.1 warrant agreement, dated july 1, 2020, between the company and continental stock transfer & trust company 10.1 letter agreement, dated july 1, 2020, among the company, capstar sponsor group, llc, gccu vi llc, tocu xxix llc and each of the executive officers and directors of the company 10.2 investment management trust agreement, dated july 1, 2020, between the company and continental stock transfer & trust company 10.3 warrant purchase agreement, dated july 1, 2020, between the company and capstar sponsor group, llc 10.4 registration and stockholder rights agreement, dated july 1, 2020, among the company and certain securityholders 10.5 administrative services agreement, dated july 1, 2020, between the company and capstar partners, llc 99.1 press release, dated july 1, 2020 4 signature pursuant to the requirements of the securities exchange act of 1934, the registrant has duly caused this report to be signed on its behalf by the undersigned hereunto duly authorized. capstar special purpose acquisition corp. by: /s/ r. steven hicks name: r. steven hicks title: chairman, chief executive officer and chief financial officer date: july 8, 2020 ",https://www.sec.gov/Archives/edgar/data/1805087/000110465920082084/0001104659-20-082084-index.htm,8-K,2020-07-08 16:21:17
