date,text,url,form,accepted_time
2020-07-30," 	 		 		document 	 	 false0001712463 		 			0001712463 		 		 			2020-07-30 			2020-07-30 		 	 		 			0001712463 			 				us-gaap:warrantmember 			 		 		 			2020-07-30 			2020-07-30 		 	 		 			0001712463 			 				us-gaap:commonclassamember 			 		 		 			2020-07-30 			2020-07-30 		 	 united statessecurities and exchange commissionwashington, d.c. 20549 form 8-k current reportpursuant to section 13 or 15(d) of the securities exchange act of 1934july 30, 2020 (date of report, date of earliest event reported) ranpak holdings corp. (exact name of registrant as specified in its charter)delaware 001-38348 98-1377160(state or other jurisdiction of (commission file number) (i.r.s. employerincorporation or organization) identification number)7990 auburn road concord township, ohio 44077 (address of principal executive offices) (zip code)(440) 354-4445 (registrant’s telephone number, including area code)not applicable(former name or former address, if changed since last report) check the appropriate box below if the form 8-k filing is intended to simultaneously satisfy the filing obligation of the registrant under any of the following provisions (see general instruction a.2. below)☐written communications pursuant to rule 425 under the securities act (17 cfr 230.425)☐soliciting material pursuant to rule 14a-12 under the exchange act (17 cfr 240.14a-12)☐pre-commencement communications pursuant to rule 14d-2(b) under the exchange act (17 cfr 240.14d-2(b))☐pre-commencement communications pursuant to rule 13e-4(c) under the exchange act (17 cfr 240.13e-4(c))securities registered pursuant to section 12(b) of the act:title of each classtrading symbol(s)name of each exchange on which registeredclass a ordinary shares, par value $0.0001 per sharepacknew york stock exchangewarrants, each whole warrant exercisable for one class apackwsnew york stock exchangeindicate by check mark whether the registrant is an emerging growth company as defined in rule 405 of the securities act of 1933 (§230.405 of this chapter) or rule 12b-2 of the securities exchange act of 1934 (§240.12b-2 of this chapter). emerging growth company ☑ if an emerging growth company, indicate by check mark if the registrant has elected not to use the extended transition period for complying with any new or revised financial accounting standards provided pursuant to section 13(a) of the exchange act. ☐ item 2.02 results of operations and financial conditionon july 30, 2020, ranpak holdings corp. (the “company”) issued a press release announcing its financial results for the quarter ended june 30, 2020. a copy of the press release is furnished herewith as exhibit 99.1, which is incorporated herein by reference. on july 30, 2020, at 8:30 a.m. (et), the company will host a conference call and webcast in which its financial results for the quarter ended june 30, 2020 will be discussed.the information included in this item, including exhibit 99.1, is hereby furnished and shall not be deemed “filed” for purposes of section 18 of the securities exchange act of 1934, as amended (the “exchange act”), nor shall it be deemed incorporated by reference in any filing under the securities act of 1933, as amended (the “securities act”), or the exchange act, except as shall be expressly set forth by specific reference in such filing.item 9.01 financial statements and exhibits(d) exhibitsexhibit no. description99.1(*) press release dated july 30, 2020 entitled “ranpak holdings corp. reports second quarter 2020 financial results”(*) furnished herewithsignaturespursuant to the requirements of the securities exchange act of 1934, as amended, the registrant has duly caused this report to be signed on its behalf by the undersigned, hereunto duly authorized. ranpak holdings corp. date:july 30, 2020 /s/ william drew william drew interim chief financial officer and chief of staff	 ",https://www.sec.gov/Archives/edgar/data/1712463/000162828020010936/0001628280-20-010936-index.htm,8-K,2020-07-30 09:07:32
2020-06-02," 8-k 1 dp129658_8k.htm form 8-k united states securities and exchange commission washington, dc 20549 form 8-k current report pursuant to section 13 or 15(d) of the securities exchange act of 1934 date of report (date of earliest event reported): may 28, 2020 ranpak holdings corp. (exact name of registrant as specified in its charter) delaware 001-38348 98-1377160 (state or other jurisdiction (commission file number) (i.r.s. employer of incorporation) identification no.) 7990 auburn road concord township, oh 44077 (address of principal executive offices) (zip code) registrant’s telephone number, including area code: +1 440-354-4445 not applicable (former name or former address, if changed since last report) check the appropriate box below if the form 8-k filing is intended to simultaneously satisfy the filing obligation of the registrant under any of the following provisions (see general instruction a.2. below): ☐ written communications pursuant to rule 425 under the securities act (17 cfr 230.425) ☐ soliciting material pursuant to rule 14a-12 under the exchange act (17 cfr 240.14a-12) ☐ pre-commencement communications pursuant to rule 14d-2(b) under the exchange act (17 cfr 240.14d-2(b)) ☐ pre-commencement communications pursuant to rule 13e-4(c) under the exchange act (17 cfr 240.13e-4(c)) indicate by check mark whether the registrant is an emerging growth company as defined in rule 405 of the securities act of 1933 (§230.405 of this chapter) or rule 12b-2 of the securities exchange act of 1934 (§240.12b-2 of this chapter). emerging growth company ☒ if an emerging growth company, indicate by check mark if the registrant has elected not to use the extended transition period for complying with any new or revised financial accounting standards provided pursuant to section 13(a) of the exchange act. ☐ title of each class trading symbol(s) name of each exchange on which registered class a common stock, par value $0.0001 per share pack new york stock exchange warrants, each whole warrant exercisable for one share of class a common stock at an exercise price of $11.50 per share pack ws new york stock exchange item 5.07. submission of matters to a vote of security holders on may 28, 2020, ranpak holdings corp. held its annual meeting of stockholders. the class i directors proposed by management were elected with a tabulation of votes to the nearest share as shown below. the directors also had broker non-votes totaling 3,659,719. for withheld michael gliedman 56,582,226 374,767 steve kovach 56,583,137 373,856 alicia tranen 56,585,715 371,278 additionally, the earlier appointment by the audit committee of the board of directors of deloitte & touche llp as the company’s independent registered public accounting firm for the 2020 fiscal year was approved by stockholders with 60,247,591 shares voted in favor, 369,121 shares voted against and 0 shares abstained. signatures pursuant to the requirements of the securities exchange act of 1934, the registrant has duly caused this report to be signed on its behalf by the undersigned hereunto duly authorized. ranpak holdings corp. date: june 2, 2020 by: /s/ william drew name: william drew title: chief financial officer ",https://www.sec.gov/Archives/edgar/data/1712463/000095010320011023/0000950103-20-011023-index.htm,8-K,2020-06-02 21:35:54
2020-05-11," 8-k 1 ea121507-8k_ranpakholdings.htm current report united states securities and exchange commission washington, dc 20549 form 8-k current report pursuant to section 13 or 15(d) of the securities exchange act of 1934 date of report (date of earliest event reported): may 11, 2020 ranpak holdings corp. (exact name of registrant as specified in its charter) delaware 001-38348 98-1377160 (state or other jurisdiction of incorporation) (commission file number) (i.r.s. employer identification no.) 7990 auburn road concord township, oh	 44077 (address of principal executive offices) (zip code) 	registrant’s telephone number, including area code: +1 440-354-4445 not applicable (former name or former address, if changed since last report) check the appropriate box below if the form 8-k filing is intended to simultaneously satisfy the filing obligation of the registrant under any of the following provisions (see general instruction a.2. below): ☐written communications pursuant to rule 425 under the securities act (17 cfr 230.425) ☐soliciting material pursuant to rule 14a-12 under the exchange act (17 cfr 240.14a-12) ☐pre-commencement communications pursuant to rule 14d-2(b) under the exchange act (17 cfr 240.14d-2(b)) ☐pre-commencement communications pursuant to rule 13e-4(c) under the exchange act (17 cfr 240.13e-4(c)) indicate by check mark whether the registrant is an emerging growth company as defined in rule 405 of the securities act of 1933 (§230.405 of this chapter) or rule 12b-2 of the securities exchange act of 1934 (§240.12b-2 of this chapter). emerging growth company ☒ if an emerging growth company, indicate by check mark if the registrant has elected not to use the extended transition period for complying with any new or revised financial accounting standards provided pursuant to section 13(a) of the exchange act. ☐ title of each class trading symbol(s) name of each exchange on which registered class a common stock, par value $0.0001 per share pack new york stock exchange warrants, each whole warrant exercisable for one share of class a common stock at an exercise price of $11.50 per share pack ws new york stock exchange item 2.02 results of operations and financial condition. on may 11, 2020, ranpak holdings corp. (the “company”) issued a press release announcing its financial results for the quarter ended march 31, 2020. a copy of the press release is furnished herewith as exhibit 99.1, which is incorporated herein by reference. on may 11, 2020, at 8:30 a.m. (et), the company will host a conference call and webcast in which its financial results for the quarter ended march 31, 2020 will be discussed. the information included in this item, including exhibit 99.1, is hereby furnished and shall not be deemed “filed” for purposes of section 18 of the securities exchange act of 1934, as amended (the “exchange act”), nor shall it be deemed incorporated by reference in any filing under the securities act of 1933, as amended (the “securities act”), or the exchange act, except as shall be expressly set forth by specific reference in such filing. item 5.02. departure of directors or certain officers; election of directors; appointment of certain officers; compensatory arrangements with certain officers. ranpak holdings corp. (the “company”) and trent meyerhoefer have agreed that, effective may 15, 2020, he will step down as the chief financial officer and leave the company to pursue other opportunities. mr. meyerhoefer has confirmed that his departure is not related to any disagreement with the company. upon mr. meyerhoefer’s departure, william drew will become the interim chief financial officer of the company. mr. drew, 38, currently serves as the chief of staff of the company, a role he has held since october 2, 2019. prior to this, from june 3, 2019, the date of the business combination with rack holdings inc., mr. drew served as head of business development. prior to the closing of the business combination, mr. drew served as the managing director of one madison group from september 2017 to june 3, 2019. previously, mr. drew spent five years at hrg group where he was vice president, investments and worked on numerous m&a and capital markets transactions. in connection with his appointment as interim chief financial officer, mr. drew will not be entitled to any additional compensation. in connection with his departure, the company and mr. meyerhoefer entered into a separation agreement and release. pursuant to his separation agreement, which becomes effective on may 15, 2020, mr. meyerhoefer will be entitled to, among the other benefits provided for in the agreement: (i) a continuation of his base salary for 12 months following the separation date at his current annual rate of $368,680, (ii) a pro rata 2020 bonus based on 2020 performance, (iii) cobra continuation premium payments for mr. meyerhoefer and his dependents for up to 6 months following the separation date and (iv) vesting of 27,094 of mr. meyerhoefer’s outstanding restricted stock units. the foregoing description of the separation agreement with mr. meyerhoefer contained herein does not purport to be complete and is qualified in its entirety by reference to the complete text of the agreement which is filed as exhibit 10.1 to this current report on form 8-k. and is incorporated by reference. 1 item 9.01 financial statements and exhibits exhibit no. description 10.1 separation agreement by and between the company and trent m. meyerhoefer dated may 6, 2020 99.1* press release dated may 11, 2020 entitled “ranpak holdings corp. reports first quarter 2020 financial results” *furnished herewith 2 signatures pursuant to the requirements of the securities exchange act of 1934, as amended, the registrant has duly caused this report to be signed on its behalf by the undersigned hereunto duly authorized. date: may 11, 2020 ranpak holdings corp. by: /s/ trent m. meyerhoefer trent m. meyerhoeferchief financial officer 3 ",https://www.sec.gov/Archives/edgar/data/1712463/000121390020011553/0001213900-20-011553-index.htm,8-K,2020-05-11 07:35:39
2020-03-05," 8-k 1 ea119336-8k_ranpakholdings.htm current report united states securities and exchange commission washington, dc 20549 form 8-k current report pursuant to section 13 or 15(d) of the securities exchange act of 1934 date of report (date of earliest event reported): march 5, 2020 ranpak holdings corp. (exact name of registrant as specified in its charter) delaware 001-38348 98-1377160 (state or other jurisdiction (commission file number) (i.r.s. employer of incorporation) identification no.) 7990 auburn road concord township, oh 44077 (address of principal executive offices) (zip code) registrant’s telephone number, including area code: +1 440-354-4445 not applicable (former name or former address, if changed since last report) check the appropriate box below if the form 8-k filing is intended to simultaneously satisfy the filing obligation of the registrant under any of the following provisions (see general instruction a.2. below): ☐written communications pursuant to rule 425 under the securities act (17 cfr 230.425) ☐soliciting material pursuant to rule 14a-12 under the exchange act (17 cfr 240.14a-12) ☐pre-commencement communications pursuant to rule 14d-2(b) under the exchange act (17 cfr 240.14d-2(b)) ☐pre-commencement communications pursuant to rule 13e-4(c) under the exchange act (17 cfr 240.13e-4(c)) indicate by check mark whether the registrant is an emerging growth company as defined in rule 405 of the securities act of 1933 (§230.405 of this chapter) or rule 12b-2 of the securities exchange act of 1934 (§240.12b-2 of this chapter). emerging growth company ☒ if an emerging growth company, indicate by check mark if the registrant has elected not to use the extended transition period for complying with any new or revised financial accounting standards provided pursuant to section 13(a) of the exchange act. ☐ title of each class trading symbol(s) name of each exchange on which registered class a common stock, par value $0.0001 per share pack new york stock exchange warrants, each whole warrant exercisable for one share of class a common stock at an exercise price of $11.50 per share pack ws new york stock exchange item 2.02results of operations and financial condition. on march 5, 2020, ranpak holdings corp. (the “company”) issued a press release announcing its financial results for the quarter and year ended december 31, 2019. a copy of the press release is furnished herewith as exhibit 99.1, which is incorporated herein by reference. on march 5, 2020, at 8:30 a.m. (et), the company will host a conference call and webcast in which its financial results for the quarter and year ended december 31, 2019 will be discussed. the information included in this item, including exhibit 99.1, is hereby furnished and shall not be deemed “filed” for purposes of section 18 of the securities exchange act of 1934, as amended (the “exchange act”), nor shall it be deemed incorporated by reference in any filing under the securities act of 1933, as amended (the “securities act”), or the exchange act, except as shall be expressly set forth by specific reference in such filing. caution about forward-looking statements this current report and the exhibit attached hereto contains “forward-looking statements” within the meaning of section 27a of the securities act of 1933, as amended (the “securities act”), and section 21e of the securities exchange act of 1934, as amended (the “exchange act”). our forward- looking statements include, but are not limited to, statements regarding our or our management team’s expectations, hopes, beliefs, intentions or strategies regarding the future. statements that are not historical facts, including statements about the parties, perspectives and expectations, are forward-looking statements. in addition, any statements that refer to estimates, projections, forecasts or other characterizations of future events or circumstances, including any underlying assumptions, are forward-looking statements. the words “anticipate,” “believe,” “continue,” “could,” “estimate,” “expect,” “forecast,” “intend,” “may,” “might,” “plan,” “possible,” “potential,” “predict,” “project,” “should,” “would” and similar expressions may identify forward-looking statements, but the absence of these words does not mean that a statement is not forward-looking. forward-looking statements in this current report and the exhibit attached hereto may include, for example, statements about: our expectations around the performance of the business; our success in retaining or recruiting, or changes required in, our officers, key employees or directors following our initial business combination; our officers and directors allocating their time to other businesses and potentially having conflicts of interest with our business; our public securities’ potential liquidity and trading; the lack of a market for our securities. the forward-looking statements contained in this current report and the exhibit attached hereto are based on our current expectations and beliefs concerning future developments and their potential effects on us taking into account information currently available to us. there can be no assurance that future developments affecting us will be those that we have anticipated. these forward-looking statements involve a number of risks, uncertainties (some of which are beyond our control) or other assumptions that may cause actual results or performance to be materially different from those expressed or implied by these forward-looking statements. these risks include, but are not limited to: (1) our inability to secure a sufficient supply of paper to meet our production requirements; (2) the impact of the price of kraft paper on our results of operations; (3) our reliance on third party suppliers; (4) the high degree of competition in the markets in which we operate; (5) consumer sensitivity to increases in the prices of our products; (6) changes in consumer preferences with respect to paper products generally; (7) continued consolidation in the markets in which we operate; (8) the loss of significant end-users of our products or a large group of such end-users; (9) our failure develop new products that meet our sales or margin expectations; (10) our future operating results fluctuating, failing to match performance or to meet expectations; (11) our ability to fulfill our public company obligations; and (12) other risks and uncertainties indicated from time to time in filings made with the sec. should one or more of these risks or uncertainties materialize, they could cause our actual results to differ materially from the forward-looking statements. we are not undertaking any obligation to update or revise any forward looking statements whether as a result of new information, future events or otherwise. you should not take any statement regarding past trends or activities as a representation that the trends or activities will continue in the future. accordingly, you should not put undue reliance on these statements. item 9.01financial statements and exhibits exhibit no. description 99.1* press release dated march 5, 2020 entitled “ranpak holdings corp. reports fourth quarter and full year 2019 financial results” *furnished herewith 1 signatures pursuant to the requirements of the securities exchange act of 1934, as amended, the registrant has duly caused this report to be signed on its behalf by the undersigned hereunto duly authorized. date: march 5, 2020 ranpak holdings corp. by: /s/ trent m. meyerhoefer trent m. meyerhoefer chief financial officer 2 ",https://www.sec.gov/Archives/edgar/data/1712463/000121390020005463/0001213900-20-005463-index.htm,8-K,2020-03-05 07:58:25
