date,text,form,accepted_time
2020-06-09," 8-k 1 ea122848-8k_schultze.htm form 8-k united states securities and exchange commission washington, d.c. 20549 form 8-k current report pursuant to section 13 or 15(d) of the securities exchange act of 1934 date of report (date of earliest event reported): june 9, 2020 schultze special purpose acquisition corp. (exact name of registrant as specified in its charter) delaware (state or other jurisdiction of incorporation) 001-38760 (commission file number) 83-0891815 (i.r.s. employer identification no.) 800 westchester avenue, suite 632 rye brook, ny (address of principal executive offices) 10573 (zip code) (914) 701-5260 (registrant’s telephone number, including area code) not applicable (former name or former address, if changed since last report) check the appropriate box below if the form 8-k is intended to simultaneously satisfy the filing obligation of the registrant under any of the following provisions: ☐ written communications pursuant to rule 425 under the securities act (17 cfr 230.425) ☐ soliciting material pursuant to rule 14a-12 under the exchange act (17 cfr 240.14a-12) ☐ pre-commencement communications pursuant to rule 14d-2(b) under the exchange act (17 cfr 240.14d-2(b)) ☐ pre-commencement communications pursuant to rule 13e-4(c) under the exchange act (17 cfr 240.13e-4(c)) securities registered pursuant to section 12(b) of the act: title of each class trading symbol(s) name of each exchange on which registered units, each consisting of one share of common stock and one warrant samau the nasdaq stock market llc common stock, par value $0.0001 per share sama the nasdaq stock market llc warrants, each warrant exercisable for one share of common stock at an exercise price of $11.50 samaw the nasdaq stock market llc indicate by check mark whether the registrant is an emerging growth company as defined in rule 405 of the securities act of 1933 (§230.405 of this chapter) or rule 12b-2 of the securities exchange act of 1934 (§240.12b-2 of this chapter). emerging growth company ☒ if an emerging growth company, indicate by check mark if the registrant has elected not to use the extended transition period for complying with any new or revised financial accounting standards provided pursuant to section 13(a) of the exchange act. ☐ item 5.03.amendments to articles of incorporation or bylaws; change in fiscal year. the information included in item 5.07 of this current report on form 8-k is incorporated by reference in this item 5.03 to the extent required herein. item 5.07.	submission of matters to a vote of security holders. on june 9, 2020, schultze special purpose acquisition corp. (the “company”) held a special meeting in lieu of the 2020 annual meeting of stockholders (the “meeting”). at the meeting, the company’s stockholders approved the following items: (i) a proposal to amend (the “charter amendment”) the company’s amended and restated certificate of incorporation to extend the date by which the company has to consummate a business combination (the “extension”) from june 13, 2020 to september 30, 2020; (ii) a proposal to re-elect (the “director proposal”) two directors, messrs. william g. laperch and william t. allen, to the company’s board of directors, with each such director to serve until the second annual meeting of stockholders following the meeting or until his successor is elected and qualified; and (iii) a proposal to ratify the selection by the company’s audit committee of marcum llp to serve as the company’s independent registered public accounting firm for the fiscal year ending december 31, 2020 (the “auditor proposal”). the affirmative vote of at least sixty-five percent (65%) of the outstanding shares of the company’s common stock (“common stock”) entitled to vote at the meeting as of may 8, 2020 (the “record date”) was required to approve the charter amendment, a plurality of the shares of common stock present in person or by proxy and entitled to vote at the meeting as of the record date and voting on the director proposal was required for the re-election of each of the directors in the director proposal and the affirmative vote of at least a majority of the shares of common stock present in person or by proxy and entitled to vote at the meeting as of the record date and voting on the auditor proposal was required to approve the auditor proposal. 34,868 shares of common stock were redeemed in connection with the extension. set forth below are the final voting results for each of the proposals: charter amendment the charter amendment was approved. the voting results of the shares of common stock were as follows: for against abstain 12,795,401 7,500 16,150 director proposal the director proposal was approved, and each of messrs. william g. laperch and william t. allen were re-elected to the company’s board of directors. the voting results of the shares of common stock were as follows: director for withheld william g. laperch 12,074,469 744,582 william t. allen 12,074,469 744,582 auditor proposal the auditor proposal was approved. the voting results of the shares of common stock were as follows: for against abstain 12,819,051 0 0 following the meeting, the company filed the charter amendment with the secretary of state of the state of delaware. a copy of the charter amendment is attached to this current report on form 8-k as exhibit 3.1 and incorporated herein by reference. item 9.01.financial statements and exhibits. (d) exhibits. exhibit no. description 3.1 amendment to the amended and restated certificate of incorporation of schultze special purpose acquisition corp., dated june 9, 2020 1 signature pursuant to the requirements of the securities exchange act of 1934, the registrant has duly caused this report to be signed on its behalf by the undersigned hereunto duly authorized. schultze special purpose acquisition corp. by: /s/ george j. schultze 	name:	george j. schultze 	title:	chief executive officer date:	june 9, 2020 2 ",8-K,2020-06-09 16:06:46
2020-06-01," 8-k 1 ea122529-8k_schultzespecial.htm current report united states securities and exchange commission washington, d.c. 20549 form 8-k current report pursuant to section 13 or 15(d) of the securities exchange act of 1934 date of report (date of earliest event reported): june 1, 2020 schultze special purpose acquisition corp. (exact name of registrant as specified in its charter) delaware 001-38760 83-0891815 (state or other jurisdiction of incorporation) (commission file number) (i.r.s. employer identification no.) 800 westchester avenue, suite 632 rye brook, ny 10573 (address of principal executive offices) (zip code) (914) 701-5260 (registrant’s telephone number, including area code) not applicable (former name or former address, if changed since last report) check the appropriate box below if the form 8-k is intended to simultaneously satisfy the filing obligation of the registrant under any of the following provisions: ☐ written communications pursuant to rule 425 under the securities act (17 cfr 230.425) ☒ soliciting material pursuant to rule 14a-12 under the exchange act (17 cfr 240.14a-12) ☐ pre-commencement communications pursuant to rule 14d-2(b) under the exchange act (17 cfr 240.14d-2(b)) ☐ pre-commencement communications pursuant to rule 13e-4(c) under the exchange act (17 cfr 240.13e-4(c)) securities registered pursuant to section 12(b) of the act: title of each class trading symbol(s) name of each exchange on which registered units, each consisting of one share of common stock and one warrant samau the nasdaq stock market llc common stock, par value $0.0001 per share sama the nasdaq stock market llc warrants, each warrant exercisable for one share of common stock at an exercise price of $11.50 samaw the nasdaq stock market llc indicate by check mark whether the registrant is an emerging growth company as defined in rule 405 of the securities act of 1933 (§230.405 of this chapter) or rule 12b-2 of the securities exchange act of 1934 (§240.12b-2 of this chapter). emerging growth company ☒ if an emerging growth company, indicate by check mark if the registrant has elected not to use the extended transition period for complying with any new or revised financial accounting standards provided pursuant to section 13(a) of the exchange act. ☐ item 7.01. regulation fd disclosure. attached as exhibit 99.1 to this current report on form 8-k and incorporated herein by reference is the investor presentation to be used by schultze special purpose acquisition corp., a delaware corporation (“sama”), in presentations for certain of sama’s stockholders and other persons with respect to the transactions contemplated by the letter of intent described below. such exhibit and the information set forth therein is being furnished and shall not be deemed to be filed for purposes of section 18 of the securities exchange act of 1934, as amended (the “exchange act”), or otherwise be subject to the liabilities of that section, nor shall it be deemed to be incorporated by reference in any filing under the securities act of 1933, as amended (the “securities act”), or the exchange act. item 8.01. other events. on june 1, 2020, sama and clever leaves international inc. (“clever leaves”) issued a joint press release announcing that sama and clever leaves had entered into a non-binding letter of intent (the “letter of intent”) for a proposed business combination transaction. clever leaves is a multi-national cannabis company with a mission to operate in compliance with federal and state laws and with an emphasis on ecologically sustainable, large-scale cultivation and pharmaceutical-grade processing as the cornerstones of its global cannabis business. with operations and investments in the united states, canada, colombia, germany and portugal, clever leaves helps the partners in its ecosystem grow rapidly and contribute value to the global community. its mission is to be one of the industry’s leading global cannabis companies recognized for its principles, people, and performance while fostering a healthier global community. under the terms of the letter of intent, sama and clever leaves intend to enter into a definitive agreement pursuant to which sama and clever leaves would combine, with the former shareholders of both entities holding equity in the combined public company listed on nasdaq and with clever leaves’ shareholders owning a majority of that equity. completion of the proposed transaction is subject to the negotiation and execution of a definitive agreement and satisfaction of the conditions therein, including approval of the transaction by sama’s stockholders. accordingly, no assurances can be made that the parties will successfully negotiate and enter into a definitive agreement, or that the proposed transaction will be consummated on the terms or timeframe currently contemplated, or at all. a copy of the press release is attached as exhibit 99.2 hereto and incorporated herein by reference. additional information and where to find it if a definitive agreement is entered into in connection with the proposed transactions described herein, sama and clever leaves will prepare a proxy statement/prospectus for sama’s stockholders to be filed with the securities and exchange commission (the “sec”). the proxy statement/prospectus will be mailed to sama’s stockholders. sama and clever leaves urge investors, stockholders and other interested persons to read, when available, the proxy statement/prospectus, as well as other documents filed with the sec, because these documents will contain important information about the proposed business combination transaction. such persons can also read sama’s annual report on form 10-k for the fiscal year ended december 31, 2019, for a description of the security holdings of its officers and directors and their respective interests as security holders in the consummation of the transactions described herein. sama’s definitive proxy statement/prospectus will be mailed to stockholders of sama as of a record date to be established for voting on the transactions described in this report. sama’s stockholders will also be able to obtain a copy of such documents, without charge, by directing a request to: schultze special purpose acquisition corp., 800 westchester avenue, suite 632, rye brook, new york 10573. these documents, once available, can also be obtained, without charge, at the sec’s web site (http://www.sec.gov). participants in solicitation sama, clever leaves and their respective directors, executive officers and other members of their management and employees, under sec rules, may be deemed to be participants in the solicitation of proxies of sama stockholders in connection with the proposed business combination. investors and security holders may obtain more detailed information regarding the names, affiliations and interests of sama’s directors in its annual report on form 10-k for the fiscal year ended december 31, 2019, which was filed with the sec on march 10, 2020. information regarding the persons who may, under sec rules, be deemed participants in the solicitation of proxies to sama’s stockholders in connection with the proposed business combination will be set forth in the proxy statement/prospectus for the proposed business combination when available. information concerning the interests of sama’s and clever leaves’ participants in the solicitation, which may, in some cases, be different than those of sama’s and clever leaves’ equity holders generally, will be set forth in the proxy statement/prospectus relating to the proposed business combination when it becomes available. 1 non-solicitation this current report on form 8-k is not a proxy statement or solicitation of a proxy, consent or authorization with respect to any securities or in respect of the proposed transaction and shall not constitute an offer to sell or a solicitation of an offer to buy the securities of sama or clever leaves, nor shall there be any sale of any such securities in any state or jurisdiction in which such offer, solicitation, or sale would be unlawful prior to registration or qualification under the securities laws of such state or jurisdiction. no offer of securities shall be made except by means of a prospectus meeting the requirements of section 10 of the securities act. forward looking statements this current report on form 8-k includes certain statements that are not historical facts but are forward-looking statements for purposes of the safe harbor provisions under the united states private securities litigation reform act of 1995. forward-looking statements generally are accompanied by words such as “believe,” “may,” “will,” “estimate,” “continue,” “anticipate,” “intend,” “expect,” “should,” “would,” “plan,” “predict,” “potential,” “seem,” “seek,” “future,” “outlook,” and similar expressions that predict or indicate future events or trends or that are not statements of historical matters. such forward-looking statements are subject to risks and uncertainties, which could cause actual results to differ from the forward-looking statements. these forward-looking statements and factors that may cause such differences include, without limitation, sama’s and clever leaves’ inability to enter into a definitive agreement with respect to the proposed business combination transaction or to complete the transactions contemplated by the letter of intent; the terms of, and the timing of entry into the proposed business combination; matters discovered by the parties as they complete their respective due diligence investigation of the other; the inability to recognize the anticipated benefits of the proposed business combination, which may be affected by, among other things, the amount of cash available following any redemptions by sama stockholders; the ability to meet nasdaq’s listing standards following the consummation of the transactions contemplated by the proposed business combination; costs related to the proposed business combination; expectations with respect to future operating and financial performance and growth, including when clever leaves will become cash flow positive; the timing of the completion of the proposed business combination; clever leaves’ ability to execute its business plans and strategy and to receive regulatory approvals; potential litigation involving the parties; global economic conditions; geopolitical events, natural disasters, acts of god and pandemics, including, but not limited to, the economic and operational disruptions and other effects of covid-19; regulatory requirement and changes thereto; access to additional financing; and other risks and uncertainties indicated from time to time in filings with the sec. other factors include the possibility that the proposed transaction does not close, including due to the failure to receive required security holder approvals, or the failure of other closing conditions. the foregoing list of factors is not exclusive. additional information concerning certain of these and other risk factors is contained in sama’s most recent filings with the sec and will be contained in the proxy statement/prospectus expected to be filed in connection with the proposed transactions described above. all subsequent written and oral forward-looking statements concerning sama or clever leaves, the transactions described herein or other matters and attributable to sama, clever leaves or any person acting on their behalf are expressly qualified in their entirety by the cautionary statements above. readers are cautioned not to place undue reliance upon any forward-looking statements, which speak only as of the date made. each of sama and clever leaves expressly disclaims any obligations or undertaking to release publicly any updates or revisions to any forward-looking statements contained herein to reflect any change in sama’s and clever leaves’ expectations with respect thereto or any change in events, conditions or circumstances on which any statement is based. item 9.01. financial statements and exhibits. (d) exhibits. exhibit no. description 99.1 form of investor presentation 99.2 press release, dated june 1, 2020 2 signature pursuant to the requirements of the securities exchange act of 1934, the registrant has duly caused this report to be signed on its behalf by the undersigned hereunto duly authorized. schultze special purpose acquisition corp. by: /s/ george j. schultze name: george j. schultze title: chief executive officer date: june 1, 2020 3 ",8-K,2020-06-01 09:37:22
2020-01-06," 8-k 1 f8k010220_schultzespecial.htm current report united states securities and exchange commission washington, d.c. 20549 form 8-k current report pursuant to section 13 or 15(d) of the securities exchange act of 1934 date of report (date of earliest event reported): january 6, 2020 (january 2, 2020) schultze special purpose acquisition corp. (exact name of registrant as specified in charter) delaware 001-38760 83-0891815 (state or other jurisdiction (commission file number) (i.r.s. employer of incorporation) identification number) 800 westchester avenue, suite 632 rye brook, ny 10573 (address of principal executive offices) (zip code) (914) 701-5260 (registrant’s telephone number, including area code) not applicable (former name or former address, if changed since last report) check the appropriate box below if the form 8-k is intended to simultaneously satisfy the filing obligation of the registrant under any of the following provisions: ☐ written communications pursuant to rule 425 under the securities act (17 cfr 230.425) ☐ soliciting material pursuant to rule 14a-12 under the exchange act (17 cfr 240.14a-12) ☐ pre-commencement communications pursuant to rule 14d-2(b) under the exchange act (17 cfr 240.14d-2(b)) ☐ pre-commencement communications pursuant to rule 13e-4(c) under the exchange act (17 cfr 240.13e-4(c)) indicate by check mark whether the registrant is an emerging growth company as defined in rule 405 of the securities act of 1933 (§ 230.405) or rule 12b-2 of the securities exchange act of 1934 (§ 240.12b-2). emerging growth company ☒ if an emerging growth company, indicate by check mark if the registrant has elected not to use the extended transition period for complying with any new or revised financial accounting standards provided pursuant to section 13(a) of the exchange act. ☐ title of each class trading symbol(s) name of each exchange on which registered units, each consisting of one share of common stock and one warrant samau the nasdaq stock market llc common stock, par value $0.0001 per share sama the nasdaq stock market llc warrants, each warrant exercisable for one share of common stock at an exercise price of $11.50 samaw the nasdaq stock market llc item 3.01.notice of delisting or failure to satisfy a continued listing rule or standard; transfer of listing. on january 2, 2020, schultze special purpose acquisition corp. (the “company”) received a written notice (the “notice”) from the listing qualifications department of the nasdaq stock market (“nasdaq”) indicating that the company is not in compliance with listing rule 5620(a), due to the company’s failure to hold an annual meeting of shareholders within twelve months of the end of the company’s fiscal year end. the notice is only a notification of deficiency, not of imminent delisting, and has no current effect on the listing or trading of the company’s securities on the nasdaq capital market. the notice states that the company has until february 17, 2020 to submit a plan to regain compliance with listing rule 5620(a). the company intends to submit a plan to regain compliance with listing rule 5620(a) within the required timeframe. if nasdaq accepts the company’s plan, nasdaq may grant the company an extension of up to 180 calendar days from the fiscal year end, or until june 29, 2020, to evidence compliance with listing rule 5620(a). if nasdaq does not accept the company’s plan, the company will have the opportunity to appeal the decision in front of a nasdaq hearings panel. forward-looking statements the company makes forward-looking statements in this report within the meaning of the private securities litigation reform act of 1995. these forward-looking statements relate to expectations or forecasts for future events. these statements may be preceded by, followed by or include the words “may,” “might,” “will,” “will likely result,” “should,” “estimate,” “plan,” “project,” “forecast,” “intend,” “expect,” “anticipate,” “believe,” “seek,” “continue,” “target” or similar expressions. these forward-looking statements are based on information available to the company as of the date of this report and involve substantial risks and uncertainties. actual results may vary materially from those expressed or implied by the forward-looking statements herein due to a variety of factors, including the company’s ability to submit a plan to regain compliance satisfactory to nasdaq; the company’s ability to hold an annual meeting; and other risks and uncertainties set forth in our reports filed with the securities and exchange commission. the company does not undertake any obligation to update forward-looking statements as a result of new information, future events or developments or otherwise. 1 signature pursuant to the requirements of the securities exchange act of 1934, the registrant has duly caused this report to be signed on its behalf by the undersigned, hereunto duly authorized. dated: january 6, 2020 schultze special purpose acquisition corp. by: /s/ george j. schultze name: george j. schultze title: chief executive officer 2 ",8-K,2020-01-06 16:10:16
